{
  "slug": "npi-taxonomy-correctness",
  "title": "NPI and taxonomy correctness",
  "hypotheses": [
    "H9",
    "H10",
    "H11",
    "H12",
    "H13"
  ],
  "status": "published",
  "release_date": "2026-08-20",
  "generated_at": "2026-10-12T18:48:55+00:00",
  "methodology_version": "0.6.0-draft",
  "commit_sha": "pending",
  "headline": "94.54% of 11.6M NDH NPIs clear NPPES (3.04% not enumerated, 0.29% deactivated). Practitioner name agreement: 89.6% exact \u2192 90.1% normalized \u2192 96.5% Jaro-Winkler \u22650.85. Organization name: 43.4% exact \u2192 69.7% normalized \u2192 77.6% Jaro-Winkler \u22650.85. Both taxonomy fields now speak NUCC: Practitioner.qualification is 99.86% valid against NUCC v17.0, and PractitionerRole.specialty, which carried CMS Medicare specialty codes through 2026-05-08, is 99.96% valid NUCC and 0.00% valid Medicare. They agree with each other on 100.0% of 5.8M Practitioner\u2194Role pairs. The NDH carries the NPPES taxonomy set, not a choice from it: 100.0% of practitioners hold a qualification matching NPPES's switch='Y' TRUE primary somewhere in the array. Position does not encode primacy, though. Reading qualification[0] alone, the earlier method here, matches the true primary for only 88.7% and any slot for 95.7%. On the NPPES side the same trap: slot_1 is not the true primary in 14.97% of rows. Neither file says which taxonomy is primary by where it sits.",
  "numerator": 5759067,
  "denominator": 5759162,
  "chart": {
    "type": "bar",
    "unit": "percent",
    "data": [
      {
        "label": "H10 NPPES match OK",
        "value": 94.54
      },
      {
        "label": "H10 not in NPPES",
        "value": 3.036
      },
      {
        "label": "H10 deactivated in NPPES",
        "value": 0.29
      },
      {
        "label": "H11 Prac exact",
        "value": 89.6
      },
      {
        "label": "H11 Prac normalized",
        "value": 90.1
      },
      {
        "label": "H11 Prac JW \u22650.85",
        "value": 96.5
      },
      {
        "label": "H11 Org exact",
        "value": 43.4
      },
      {
        "label": "H11 Org normalized",
        "value": 69.7
      },
      {
        "label": "H11 Org JW \u22650.85",
        "value": 77.6
      },
      {
        "label": "H12 NUCC valid",
        "value": 99.86
      },
      {
        "label": "H12 CMS code valid",
        "value": 0.0
      },
      {
        "label": "H13 internal crosswalk",
        "value": 100.0
      },
      {
        "label": "H13 NDH\u2194NPPES slot 1",
        "value": 90.7
      },
      {
        "label": "H13 NDH\u2194NPPES true primary",
        "value": 88.7
      },
      {
        "label": "H13 NDH\u2194NPPES any of 15",
        "value": 95.7
      }
    ]
  },
  "notes": "METHOD CHANGE 2026-08-28. Three figures here read only the first entry of a repeating FHIR element and now read every entry. PractitionerRole.specialty is 0..* and 421,613 role records carry more than one, up to 17; Practitioner.qualification is 0..* as well. H12 role-specialty validity now covers 5759163 entries against 5275636 under the old method. H13 internal agreement is 100.0% of 5759162 pairs, against 100.0% of 5275635 pairs first-entry-only. H13b external agreement is reported across every taxonomy qualification; the qualification[0]-only figures were 88.7% true primary, 95.7% any slot and 7.0% secondary only, and 4908527 practitioners carry more than one taxonomy qualification. Both forms are computed so the previously published numbers stay reproducible. Source: bigquery-public-data.nppes.npi_raw (updated 2026-02-09, 9.37M NPIs) + .healthcare_provider_taxonomy_code_set_170 + CMS Medicare Provider and Supplier Taxonomy Crosswalk (2025-10, 565 rows, 1-to-many). H11 v2 methodology \u2014 three tiers: (1) exact match on UPPER(TRIM), (2) normalized match that strips business suffixes (LLC/INC/CORP/PC/PA/PLLC/LLP/LTD/CO/COMPANY/THE for Orgs; JR/SR/II\u2013V/MD/DO/PHD/RN/NP/PA-C/FNP-BC/DMD/DDS/DVM/PHARMD for persons), drops non-alphanumeric, collapses whitespace, (3) Jaro-Winkler \u22650.85 via a BQ JS UDF. Practitioner name: 6,498,536/7,126,309 family exact, 6,420,103 normalized full match, 6,879,542 at JW\u22650.85, 6,497,337 at JW\u22650.95. Organization name: 1,679,807/3,866,592 exact, 2,693,913 normalized, 2,999,412 at JW\u22650.85, 2,891,845 at JW\u22650.95. H12: NUCC codes on Practitioner.qualification (7,357,424/7,368,037 valid in NUCC v17.0); Medicare codes on PractitionerRole.specialty (0/5,759,163 valid in the crosswalk). NDH PractitionerRole._specialty_code carries a leading 'NN-' prefix (e.g. '14-50'); stripping recovers the canonical Medicare code. H10's not-enumerated count is bounded by the reference data, not by the directory. bigquery-public-data.nppes.npi_raw is a static snapshot whose newest enumeration is 2026-02-07, so every provider the NDH lists who was enumerated after that date is counted as missing from NPPES. Eight sampled at random resolved to real, active providers in the live NPPES registry with enumeration dates between February and June 2026. Read the figure as an upper bound on ghost NPIs, and see the high-risk-cohort finding, which scores this signal at zero for the same reason. Organization name agreement is reported over the whole Organization file, half of which is now `ein` tax records rather than provider organizations. Split by record type, exact match is 46.4% on provider records and 40.6% on ein records, so the fall from the 2026-05-08 figure is not explained by the ein rows being dragged in. Source-side schema change at 2026-08-20: the provider-taxonomy coding system moved from 'http://nucc.org/provider-taxonomy' to 'http://hl7.org/fhir/us/ndh/ValueSet/HealthcareIndividualTaxonomyVS' (7,368,037 qualification codings under the new URL, 0 under the old one), and PractitionerRole.specialty moved from CMS Medicare specialty codes to NUCC taxonomy codes. The new URL is a ValueSet canonical in a field FHIR defines as a CodeSystem canonical. A parser matching the old literal returns zero rows and does not error, which is how the first run of this script against the August release reported 0% specialty validity. H13 internal: 5,759,162 Practitioner\u2194Role pairs, 5,759,067 where the role specialty code is also one of the practitioner's qualification codes. H13 confusion matrix \u2014 top 10 inconsistent (Medicare \u2192 qualification-NUCC) pairs: n/a. H13 external (v3 \u2014 switch-aware): NPPES stores 15 (taxonomy_code, primary_switch) pairs per NPI; exactly one should have switch='Y' (the TRUE primary). Four buckets:\n  \u2022 Match NPPES true primary (switch='Y' slot): 6,318,249 (88.68%)\n  \u2022 Match any slot:           6,820,062 (95.72%)\n  \u2022 Match slot_1 specifically:6,465,092 (90.74%)\n  \u2022 Match only a secondary (switch='N'): 501,813 (7.04%)\n  \u2022 Disagree entirely (not in any slot): 304,895 (4.28%)\nSlot-ordering observation: 1,066,563 rows (14.97%) have the NPPES TRUE primary in a slot other than slot_1 \u2014 so the prior 'slot_1' proxy for 'primary' was slightly wrong. 0 rows (0.00%) have no switch='Y' at all (NPPES data-quality edge). Known caveats: NPPES vintage 2026-02-09 vs NDH 2026-08-20 \u2014 8-week gap means taxonomy changes in that window show as disagreement; Jaro-Winkler \u22650.85 is a permissive threshold that recovers common variations (whitespace, DBA suffixes, casing) but also accepts some false positives (e.g. 'Smith Medical' vs 'Smith Medicare'); the 0.95 column is the strict signal. v2 upgrade candidates: pinned quarterly NUCC; NPPES secondary-taxonomy match; phonetic fallback (Soundex / Metaphone) for names where JW misses transpositions."
}
