{
  "slug": "mco-exposure-va",
  "title": "VA payer networks containing federally excluded providers (methodology demo)",
  "hypotheses": [
    "H26"
  ],
  "status": "published",
  "release_date": "2026-10-07",
  "generated_at": "2026-10-14T02:45:51+00:00",
  "methodology_version": "0.5.0",
  "commit_sha": "6e74041",
  "headline": "5 of 108 federally excluded VA-resident providers (LEIE or SAM, score >= 1.5) appear in at least one of 4 wired payer provider directories. Per-payer: Humana 0, Cigna 5, UnitedHealthcare 0, Molina 0.",
  "numerator": 5,
  "denominator": 108,
  "chart": {
    "type": "bar",
    "unit": "count",
    "data": [
      {
        "label": "Humana",
        "value": 0
      },
      {
        "label": "Cigna",
        "value": 5
      },
      {
        "label": "UnitedHealthcare",
        "value": 0
      },
      {
        "label": "Molina",
        "value": 0
      }
    ]
  },
  "notes": "v1 methodology demonstration. Cross-references the VA-resident critical-bucket cohort (LEIE or SAM, score >= 1.5) against 4 publicly-queryable payer FHIR endpoints. Humana accepts `?identifier=NPI` directly; Cigna does not (its CapabilityStatement rejects identifier search) so we name-search and post-filter the Bundle by NPI. Each match is a data-quality and triage signal aligned with 42 CFR \u00a7 455.436 and \u00a7 438.602 \u2014 investigation, hearing rights, and reinstatement claims belong to the payer and the excluding agency. Provider directory listing alone does not establish current billing privileges or active patient assignment. "
}
