{
  "slug": "temporal-staleness",
  "title": "Temporal staleness",
  "hypotheses": [
    "H18"
  ],
  "status": "published",
  "release_date": "2026-10-07",
  "generated_at": "2026-10-14T01:14:22+00:00",
  "methodology_version": "0.1.0-draft",
  "commit_sha": "pending",
  "headline": "100.0% of NPD resources carry a meta.lastUpdated value on the release day (2026-10-07). Distinct meta.lastUpdated values range from 1 to 8 across the 6 resource types \u2014 meta.lastUpdated on the NPD bulk public-use files is a bulk-export stamp, not a per-resource freshness signal.",
  "numerator": 24760877,
  "denominator": 24761919,
  "chart": {
    "type": "bar",
    "unit": "count",
    "data": [
      {
        "label": "practitioner",
        "value": 1
      },
      {
        "label": "organization",
        "value": 8
      },
      {
        "label": "location",
        "value": 1
      },
      {
        "label": "endpoint",
        "value": 1
      },
      {
        "label": "practitioner_role",
        "value": 2
      },
      {
        "label": "organization_affiliation",
        "value": 2
      }
    ]
  },
  "notes": "Per-resource distinct meta.lastUpdated values on release day 2026-10-07: practitioner \u2192 1 distinct, 100.00% at modal; organization \u2192 8 distinct, 96.03% at modal; location \u2192 1 distinct, 100.00% at modal; endpoint \u2192 1 distinct, 100.00% at modal; practitioner_role \u2192 2 distinct, 96.42% at modal; organization_affiliation \u2192 2 distinct, 96.25% at modal. Regulatory compliance with the 30-day CMS-9115-F or 90-day REAL Health Providers Act / No Surprises Act update cadence CANNOT be measured from meta.lastUpdated on the bulk files \u2014 a per-record freshness signal from upstream NPPES (enumeration_date / last_updated) or PECOS would be required."
}
