{
  "slug": "duplicate-detection",
  "title": "Duplicate detection",
  "hypotheses": [
    "H14",
    "H15"
  ],
  "status": "published",
  "release_date": "2026-10-07",
  "generated_at": "2026-10-26T16:01:17+00:00",
  "methodology_version": "0.1.0-draft",
  "commit_sha": "pending",
  "headline": "Practitioner dedup is clean: 0 excess rows across 7,481,907 NPIs (H14). Organization multiplicity looks far worse than it is. 3.4% of the 1,976,702 unique Org NPIs map to more than one Organization resource, but 99.9% of that excess is one provider record paired with one `ein` tax record under the same NPI, which is how CMS models the file rather than a duplication defect. Strip those and 7 of 1,976,702 Org NPIs are genuinely repeated. Any count of organizations in this directory has to say which record type it counted.",
  "numerator": 127322,
  "denominator": 8865336,
  "chart": {
    "type": "bar",
    "unit": "percent",
    "data": [
      {
        "label": "H14 Practitioner by NPI",
        "value": 0.0
      },
      {
        "label": "H15 Org by name+state+city",
        "value": 9.2034
      },
      {
        "label": "H15b Org by NPI (raw)",
        "value": 3.4294
      },
      {
        "label": "H15b Org by NPI (ein excluded)",
        "value": 0.0004
      }
    ]
  },
  "notes": "BigQuery dataset has primary-key dedup applied at ingest (-4.6M Practitioner, -383K Organization at _id). These are residual entity-level duplicates. H14 key = _npi on practitioner. Max copies observed: 1 for a single Practitioner NPI. H15 key = (LOWER(name) stripped of LLC/INC/PC/PA/PLLC/CORP/LLP/LTD/CO/COMPANY/THE and non-alphanumerics, UPPER(state), UPPER(TRIM(city))); orgs with missing name or state or city are excluded. Max copies for one key: 7527. H15-bonus keys by _npi; max copies for one Org NPI: 3. Earlier releases of this finding carried a caveat that some of the Organization multiplicity might reflect CMS modeling rather than duplication. That is now measured rather than speculated: 67,782 of the 67,853 excess rows (99.9%) are one provider record and one `ein` tax record sharing an NPI, and 67,718 NPIs are exactly that pair and nothing else. 7 NPIs are duplicated with no ein row involved, which is the residual worth treating as a defect. The raw rate is still the right number for anyone doing COUNT(Organization), because the rows are really there; it is the wrong number for judging directory hygiene. Fuzzy matching (Jaro-Winkler, suite-unit tolerance) is a v2 enhancement."
}
