{
  "slug": "sam-exclusions",
  "title": "SAM.gov excluded providers in NDH",
  "hypotheses": [
    "H25"
  ],
  "status": "published",
  "release_date": "2026-08-20",
  "generated_at": "2026-10-12T18:50:09+00:00",
  "methodology_version": "0.4.0",
  "commit_sha": "05fa715",
  "headline": "3,715 distinct NPIs on SAM.gov's active exclusion list appear as NDH practitioners \u2014 3,715 still flagged `active=true` in the 2026-08-20 bulk export. SAM aggregates HHS LEIE + OPM FEHBP debarment + other federal-agency actions. The OPM slice is net-new federal-screening signal beyond what LEIE alone surfaces.",
  "numerator": 3715,
  "denominator": 7063,
  "chart": {
    "type": "bar",
    "unit": "count",
    "data": [
      {
        "label": "HHS",
        "value": 3643
      },
      {
        "label": "OPM",
        "value": 1697
      },
      {
        "label": "(unattributed)",
        "value": 2
      }
    ]
  },
  "notes": "SAM source: sam.gov/data-services/Exclusions/Public V2 (V2_26120 extract). Total SAM rows: 167,262; with real-format NPI: 7,063 (4.2%); active + with NPI: 7,063. The 96% of SAM rows without a populated NPI are non-healthcare exclusions (OFAC sanctions, EPA contractor debarment, etc.) and are out of scope for this NPI-keyed match. The HHS-slice match overlaps substantially with the H24 LEIE finding by design \u2014 the same exclusion appears in both feeds. Each match is a data-quality flag, not a fraud determination \u2014 investigation, hearing rights, and reinstatement claims belong to the excluding agency. sam.gov/search/?index=ex is the authoritative source for any individual verification."
}
