{
  "slug": "network-adequacy-gauge",
  "title": "Network adequacy gauge",
  "hypotheses": ["H22"],
  "status": "pre-registered",
  "release_date": "2026-04-09",
  "generated_at": "2026-04-18T00:00:00Z",
  "methodology_version": "0.1.0-draft",
  "commit_sha": "pending",
  "headline": null,
  "numerator": null,
  "denominator": null,
  "chart": null,
  "notes": "Results await ainpi-probe crawler run. Compares empirical endpoint-liveness rate against the 85% regulatory line."
}
